{
  "$schema": "../schemas/automation.schema.json",
  "version": "1.0.0",
  "lastUpdated": "2025-11-25T22:41:00Z",
  "description": "ğŸ§¬ High-level configs that automation/agents read",
  "coreRepos": [
    "blackroad-os-core",
    "blackroad-os-web",
    "blackroad-os-api",
    "blackroad-os-api-gateway"
  ],
  "livePacks": [
    "blackroad-os-pack-education",
    "blackroad-os-pack-infra-devops"
  ],
  "experimentalPacks": [
    "blackroad-os-pack-finance",
    "blackroad-os-pack-legal",
    "blackroad-os-pack-creator-studio"
  ],
  "allowedEnvironments": ["dev", "staging", "prod"],
  "labels": {
    "priority": {
      "critical": {
        "name": "priority: critical",
        "color": "b60205",
        "description": "ğŸ”´ Critical priority - immediate attention required",
        "emoji": "ğŸ”´"
      },
      "high": {
        "name": "priority: high",
        "color": "d93f0b",
        "description": "ğŸŸ  High priority",
        "emoji": "ğŸŸ "
      },
      "medium": {
        "name": "priority: medium",
        "color": "fbca04",
        "description": "ğŸŸ¡ Medium priority",
        "emoji": "ğŸŸ¡"
      },
      "low": {
        "name": "priority: low",
        "color": "0e8a16",
        "description": "ğŸŸ¢ Low priority",
        "emoji": "ğŸŸ¢"
      }
    },
    "status": {
      "ready": {
        "name": "status: ready",
        "color": "0e8a16",
        "description": "ğŸŸ¢ Ready for production",
        "emoji": "ğŸŸ¢"
      },
      "in-progress": {
        "name": "status: in-progress",
        "color": "fbca04",
        "description": "ğŸŸ¡ Work in progress",
        "emoji": "ğŸŸ¡"
      },
      "experimental": {
        "name": "status: experimental",
        "color": "d93f0b",
        "description": "ğŸŸ  Experimental feature",
        "emoji": "ğŸŸ "
      },
      "blocked": {
        "name": "status: blocked",
        "color": "b60205",
        "description": "ğŸ”´ Blocked by dependency",
        "emoji": "ğŸ”´"
      }
    },
    "type": {
      "feature": {
        "name": "type: feature",
        "color": "1d76db",
        "description": "âœ¨ New feature",
        "emoji": "âœ¨"
      },
      "bug": {
        "name": "type: bug",
        "color": "b60205",
        "description": "ğŸ› Bug fix",
        "emoji": "ğŸ›"
      },
      "docs": {
        "name": "type: docs",
        "color": "0075ca",
        "description": "ğŸ“– Documentation",
        "emoji": "ğŸ“–"
      },
      "infra": {
        "name": "type: infra",
        "color": "d4c5f9",
        "description": "â˜ï¸ Infrastructure",
        "emoji": "â˜ï¸"
      },
      "security": {
        "name": "type: security",
        "color": "b60205",
        "description": "ğŸ” Security",
        "emoji": "ğŸ”"
      }
    },
    "domain": {
      "core": {
        "name": "domain: core",
        "color": "5319e7",
        "description": "ğŸ§± Core platform",
        "emoji": "ğŸ§±"
      },
      "frontend": {
        "name": "domain: frontend",
        "color": "1d76db",
        "description": "ğŸŒ Frontend",
        "emoji": "ğŸŒ"
      },
      "backend": {
        "name": "domain: backend",
        "color": "0e8a16",
        "description": "ğŸ”Œ Backend",
        "emoji": "ğŸ”Œ"
      },
      "infra": {
        "name": "domain: infra",
        "color": "d4c5f9",
        "description": "â˜ï¸ Infrastructure",
        "emoji": "â˜ï¸"
      },
      "packs": {
        "name": "domain: packs",
        "color": "fbca04",
        "description": "ğŸ“¦ Packs",
        "emoji": "ğŸ“¦"
      }
    },
    "compliance": {
      "sensitive": {
        "name": "compliance: sensitive",
        "color": "b60205",
        "description": "âš–ï¸ Compliance-sensitive",
        "emoji": "âš–ï¸"
      },
      "finance": {
        "name": "compliance: finance",
        "color": "b60205",
        "description": "ğŸ’° Finance-related",
        "emoji": "ğŸ’°"
      },
      "identity": {
        "name": "compliance: identity",
        "color": "b60205",
        "description": "ğŸªª Identity-related",
        "emoji": "ğŸªª"
      }
    }
  },
  "projectFields": {
    "status": {
      "type": "single-select",
      "options": ["Backlog", "Todo", "In Progress", "In Review", "Done", "Archived"]
    },
    "priority": {
      "type": "single-select",
      "options": ["Critical", "High", "Medium", "Low"]
    },
    "sprint": {
      "type": "iteration",
      "duration": "2 weeks"
    },
    "estimate": {
      "type": "number",
      "unit": "story points"
    },
    "owner": {
      "type": "single-select",
      "options": ["core-platform", "frontend", "backend", "infrastructure", "observability", "packs", "brand-docs", "research", "orchestration"]
    }
  }
}
